{
  "apiVersion": "agentic-sdlc-kit/v1",
  "id": "verification-sources-current",
  "version": "1",
  "status": "satisfied",
  "requiredSourceTypes": ["ci"],
  "requiredIssuers": ["forge-ci"],
  "revision": "a14be72",
  "freshnessRequired": true,
  "satisfiedBy": ["src-ci-small-web-01"],
  "decidedAt": "2026-08-30T09:21:00Z"
}
